{
  "schema_version": 1,
  "revision": 7,
  "generated_at": "2026-10-18T15:43:02.118Z",
  "source": {
    "system": "RCTimingControl",
    "club_name": "Wyvern RC Club"
  },
  "event": {
    "racehub_event_id": "evt-2026-round-3",
    "rctc_event_id": 21,
    "name": "Club Round 3",
    "date": "2026-10-18",
    "status": "IN_PROGRESS"
  },
  "races": [
    {
      "rctc_race_id": 398,
      "rctc_event_class_id": 37,
      "racehub_event_class_ids": [
        "rh-class-buggy"
      ],
      "class_name": "2WD Buggy",
      "round_type": "QUALIFIER",
      "round_number": 2,
      "heat_number": 1,
      "final_letter": null,
      "status": "ABANDONED",
      "finished_at": "2026-10-18T11:05:33Z",
      "results": []
    },
    {
      "rctc_race_id": 412,
      "rctc_event_class_id": 37,
      "racehub_event_class_ids": [
        "rh-class-buggy"
      ],
      "class_name": "2WD Buggy",
      "round_type": "FINAL",
      "round_number": 1,
      "heat_number": 1,
      "final_letter": "A",
      "status": "FINISHED",
      "finished_at": "2026-10-18T15:42:10Z",
      "results": [
        {
          "position": 1,
          "external_source": "RACEHUB",
          "entry_id": "6f1c2a9e-0d4b-4c55-9b1e-2f9d1c7a5e01",
          "driver_profile_id": "drv-ada",
          "racehub_event_class_id": "rh-class-buggy",
          "rctc_entry_id": 1201,
          "rctc_competitor_id": 88,
          "display_name": "Ada Lovelace",
          "car_number": "1",
          "laps": 22,
          "total_time_ms": 301456,
          "best_lap_ms": 13102,
          "penalties": []
        },
        {
          "position": 2,
          "external_source": "RACEHUB",
          "entry_id": "0b7e4d12-8a3f-4f0e-a1c2-9e5d6b4c3a02",
          "driver_profile_id": "drv-grace",
          "racehub_event_class_id": "rh-class-buggy",
          "rctc_entry_id": 1202,
          "rctc_competitor_id": 89,
          "display_name": "Grace Hopper",
          "car_number": "2",
          "laps": 21,
          "total_time_ms": 300990,
          "best_lap_ms": 13250,
          "penalties": [
            {
              "type": "LAP",
              "value": 1,
              "reason": "Short cut at the chicane",
              "included_in_result": true
            }
          ]
        },
        {
          "position": 3,
          "external_source": null,
          "entry_id": null,
          "driver_profile_id": null,
          "racehub_event_class_id": null,
          "rctc_entry_id": 1250,
          "rctc_competitor_id": 140,
          "display_name": "Walk-in Wendy",
          "car_number": "3",
          "laps": 20,
          "total_time_ms": 302004,
          "best_lap_ms": 14011,
          "penalties": []
        }
      ]
    }
  ],
  "championships": [
    {
      "rctc_championship_id": 3,
      "name": "Winter Series 2026",
      "round_number": 3,
      "classes": [
        {
          "rctc_racing_class_id": 5,
          "class_name": "2WD Buggy",
          "standings": [
            {
              "position": 1,
              "external_source": "RACEHUB",
              "driver_profile_id": "drv-ada",
              "rctc_competitor_id": 88,
              "display_name": "Ada Lovelace",
              "total_points": 96,
              "round_position": 1,
              "round_points": 25,
              "round_dropped": false,
              "round_excluded": false
            },
            {
              "position": 2,
              "external_source": "RACEHUB",
              "driver_profile_id": "drv-grace",
              "rctc_competitor_id": 89,
              "display_name": "Grace Hopper",
              "total_points": 90,
              "round_position": 2,
              "round_points": 22,
              "round_dropped": false,
              "round_excluded": false
            },
            {
              "position": 2,
              "external_source": null,
              "driver_profile_id": null,
              "rctc_competitor_id": 140,
              "display_name": "Walk-in Wendy",
              "total_points": 90,
              "round_position": 3,
              "round_points": 20,
              "round_dropped": true,
              "round_excluded": false
            }
          ]
        }
      ]
    }
  ]
}
